Article Number,Article,Title,Description
214,214. High Courts for States There shall be a High Court for each State,Article 214: High Courts for States,Every State will have its own High Court.
215,215. High Courts to be courts of record Every High Court shall be a court of record and shall have all the powers of such a court including the power to punish for contempt of itself,Article 215: High Courts to be Courts of Record,"Every High Court is a court of record, meaning it keeps official records of its proceedings and has the power to punish people for contempt (disrespect)."
216,216. Constitution of High Courts Every High Court shall consist of a Chief Justice and such other Judges as the President may from time to time deem it necessary to appoint,Article 216: Constitution of High Courts,"Every High Court will have a Chief Justice and other judges, as decided by the President."
217,"217. Appointment and conditions of the office of a Judge of a High Court
 (1) Every Judge of a High Court shall be appointed by the President by warrant under his hand and seal after consultation with the Chief Justice of India, the Governor of the State, and, in the case of appointment of a Judge other than the chief Justice, the chief Justice of the High court, and shall hold office, in the case of an additional or acting Judge, as provided in Article 224, and in any other case, until he attains the age of sixty two years Provided that
 (a) a Judge may, by writing under his hand addressed to the President, resign his office;
 (b) a Judge may be removed from his office by the President in the manner provided in clause ( 4 ) of Article 124 for the removal of a Judge of the Supreme Court;
 (c) the office of a Judge shall be vacated by his being appointed by the President to be a Judge of the Supreme Court or by his being transferred by the President to any other High Court within the territory of India
 (2) A person shall not be qualified for appointment as a Judge of a High Court unless he is a citizen of India and
 (a) has for at least ten years held a judicial office in the territory of India; or
 (b) has for at least ten years been an advocate of a High Court or of two or more such Courts in succession; Explanation For the purposes of this clause
 (a) in computing the period during which a person has held judicial office in the territory of India, there shall be included any period, after he has held any judicial office, during which the person has been an Advocate of a High Court or has held the office of a member of a tribunal or any post, under the Union or a State, requiring special knowledge of law;
 (aa) in computing the period during which a person has been an advocate of a High Court, there shall be included any period during which the person has held judicial office or the office of a member of a tribunal or any post, under the Union or a State, requiring special knowledge of law after he became an advocate;
 (b) in computing the period during which a person has held judicial office in the territory of India or been an advocate of High Court, there shall be included any period before the commencement of this Constitution during which he has held judicial office in any area which was comprised before the fifteenth day of August, 1947 , within India as defined by the Government of India Act, 1935 , or has been an advocate of any High Court in any such area, as the case may be
 (3) If any question arises as to the age of a Judge of a High Court, the question shall be decided by the President after consultation with the Chief Justice of India and the decision of the President shall be final",Article 217: Appointment and Conditions of the Office of a Judge of a High Court,"This outlines how Judges of High Courts in India are appointed, their qualifications, term of office, and conditions for leaving office.

(1) Appointment Process:
Who appoints?
Judges of a High Court are appointed by the President of India.
Who is consulted?
The Chief Justice of India (CJI),
The Governor of the State where the High Court is located, and
In case of a Judge other than the Chief Justice, the Chief Justice of the respective High Court.
Tenure:
A Judge holds office until they reach the age of 62 years. However:
Resignation: A Judge can resign by writing to the President.
Removal: A Judge can be removed by the President as per the procedure in Article 124(4) (same as for Supreme Court Judges, which involves impeachment).
Transfer: A Judge may vacate the office if appointed to the Supreme Court or transferred to another High Court.
(2) Qualifications to Become a High Court Judge:
To be appointed as a High Court Judge, a person must:

Be a Citizen of India.
Have one of the following legal experiences:
At least 10 years of holding a judicial office in India, OR
At least 10 years of being an advocate in a High Court (or multiple High Courts in succession).
Explanation:

Certain periods can be added to the required 10 years of experience:
If a person has worked as a judicial officer and later practiced as an advocate, the time spent in both roles can be combined.
If a person has held legal positions requiring special knowledge of law (e.g., tribunal member, government legal advisor), this time can also count toward the 10 years.
Experience gained before 15th August 1947 in judicial or legal roles under the Government of India Act, 1935, is also counted.
(3) Resolving Age Disputes:
If there is a dispute about the age of a Judge, the matter is decided by the President after consulting the Chief Justice of India.
The decision of the President is final."
218,218. Application of certain provisions relating to Supreme Court to High Courts The provisions of clauses ( 4 ) and ( 5 ) of Article 124 shall apply in relation to a High Court as they apply in relation to the Supreme Court with the substitution of references to the High Court for references to the Supreme Court,Article 218: Same Rules for High Courts as for Supreme Court,"This article ensures that the procedures and rules followed by the Supreme Court also apply to the High Courts in most cases. However, the application of these rules to High Courts can be modified to fit their context. Essentially, it treats the High Court as a smaller version of the Supreme Court with some rules that apply to both courts."
219,"219. Oath or affirmation by Judges of High Courts Every person appointed to be a Judge of a High Court shall, before he enters upon his office, make and subscribe before the Governor of the State, or some person appointed in that behalf by him, an oath or affirmation according to the form set out for the purpose in the Third Schedule",Article 219: Judges of High Courts Must Take an Oath,"Before taking office, judges of a High Court must take an oath in front of the Governor of the state. The oath is a promise to perform their duties fairly, impartially, and in accordance with the Constitution. This helps ensure that the judge commits to acting justly and according to the law."
220,"220. Restriction on practice after being a permanent Judge No person who, after the commencement of this Constitution, has held office as a permanent Judge of a High Court shall plead or act in any court or before any authority in India except the Supreme Court and the other High Courts Explanation In this article, the expression High Court does not include a High Court for a State specified in Part B of the First Schedule as it existed before the commencement of the Constitution (seventh Amendment) Act, 1956",Article 220: Judges Cannot Practice Law After Being Appointed,"Once appointed as a judge of a High Court, a person cannot practice law in any other court in India. This prevents conflicts of interest and ensures that judges remain neutral and unbiased. However, they can practice law in the Supreme Court or in other High Courts."
221,"221. Salaries etc, of Judges
 (1) There shall be paid to the Judges of each High Court such salaries as may be determined by Parliament by law and, until provision in that behalf is so made, such salaries as are specified in the Second Schedule
 (2) Every Judge shall be entitled to such allowances and to such rights in respect of leave of absence and pension as may from time to time be determined by or under law made by Parliament and, until so determined, to such allowances and rights as are specified in the Second Schedule: Provided that neither the allowances of a Judge nor his rights in respect of leave of absence shall be varied to his disadvantage after his appointment",Article 221: Judges' Salaries and Benefits,"The salaries and benefits of High Court judges are determined by the government. The article guarantees that once a judge is appointed, their salary cannot be reduced during their term. It also includes things like pension and other benefits after retirement. This ensures that judges are not financially influenced and can perform their duties with independence."
222,"222. Transfer of a Judge from one High Court to another
 (1) The President may, after consultation with the Chief Justice of India, transfer a Judge from one High Court to any other High Court
 (2) When a Judge has been or is so transferred, he shall, during the period he serves, after the commencement of the Constitution (Fifteenth Amendment) Act, 1963 , as a Judge of the other High Court, be entitled to receive in addition to his salary such compensatory allowance as may be determined by Parliament by law and, until so determined, such compensatory allowance as the President may by order fix",Article 222: Moving Judges Between High Courts,"If the President of India believes a judge should be moved from one High Court to another, they can do so after consulting with the Chief Justice of India. The judge’s salary and other benefits are protected during the move, and the judge is entitled to travel allowances as well. This provision allows for the flexibility to place judges where they are most needed."
223,"223. Appointment of acting Chief Justice When the office of Chief Justice of High Court is vacant or when any such Chief Justice is, by reason of absence or otherwise, unable to perform the duties of his office, the duties of the office shall be performed by such one of the other Judges of the Court as the President may appoint for the purposes",Article 223: Appointment of Acting Chief Justice,"If the Chief Justice of a High Court is unable to perform their duties (due to illness, vacation, etc.), the President can appoint an acting Chief Justice. This temporary Chief Justice will carry out the responsibilities of the Chief Justice until the original one returns."
224,"224. Appointment of additional and acting Judges
 (1) If by reason of any temporary increase in the business of High Court or by reason of arrears of work therein, it appears to the President that the number of the Judges of that Court should be for the time being increased, the President may appoint duly qualified persons to be additional Judges of the Court for such period not exceeding two years as he may specific
 (2) When any Judge of a High Court other than the Chief Justice is by reason of absence or for any other reason unable to perform the duties of his office or is appointed to act temporarily as Chief Justice, the President may appoint a duly qualified person to act as a Judge of that Court until the permanent Judge has resumed his duties
 (3) No person appointed as an additional or acting Judge of a High Court shall hold office after attaining the age of sixty two years",Article 224: Appointment of Additional and Acting Judges,"(1) Appointment of Additional Judges
When there is a temporary increase in cases or pending work (arrears) in a High Court, the President can increase the number of Judges.
Additional Judges are appointed for a specified period, not exceeding two years.
Only individuals who meet the qualifications under Article 217 can be appointed.
(2) Appointment of Acting Judges
If a permanent Judge (other than the Chief Justice):
Is absent, or
Unable to perform duties, or
Is temporarily acting as Chief Justice,
the President can appoint a qualified person as an Acting Judge.
The Acting Judge will serve until the permanent Judge resumes duties.
(3) Age Limit
No additional or acting Judge can hold office after reaching the age of 62 years.
Article 224A: Appointment of Retired Judges at High Court Sittings
Request for Retired Judges
The Chief Justice of a High Court can, with the President’s prior consent, request a retired Judge:
From the same High Court, or
From any other High Court,
to sit and act as a Judge for that High Court.
Consent and Allowances
The retired Judge:
Must agree to this request.
Will receive allowances as determined by the President.
While serving, will have the same jurisdiction, powers, and privileges as a regular Judge.
However, the retired Judge will not be considered a permanent Judge of the High Court."
225,"225. Jurisdiction of existing High Courts Subject to the provisions of this Constitution and to the provisions of any law of the appropriate Legislature made by virtue of powers conferred on that Legislature by this Constitution, the jurisdiction of, and the law administered in, any existing High Court, and the respective powers of the Judges thereof in relation to the administration of justice in the Court, including any power to make rules of Court and to regulate the sittings of the Court and of members thereof sitting alone or in Division Courts, shall be the same as immediately before the commencement of this Constitution: Provided that any restriction to which the exercise of original jurisdiction by any of the High Courts with respect to any matter concerning the revenue or concerning any act ordered or done in the collection thereof was subject immediately before the commencement of this Constitution shall no longer apply to the exercise of such jurisdiction",Article 225: Powers of Existing High Courts,"Before the Constitution, some High Courts already existed. Article 225 confirms that these courts continue to have the same powers, like hearing cases and making decisions, unless the Constitution itself says otherwise. The article ensures that existing judicial structures were not disrupted by the new Constitution."
226,"""226. Power of High Courts to issue certain writs
 (1) Notwithstanding anything in Article 32 every High Court shall have powers, throughout the territories in relation to which it exercise jurisdiction, to issue to any person or authority, including in appropriate cases, any Government, within those territories directions, orders or writs, including writs in the nature of habeas corpus, mandamus, prohibitions, quo warranto and certiorari, or any of them, for the enforcement of any of the rights conferred by Part III and for any other purpose
 (2) The power conferred by clause ( 1 ) to issue directions, orders or writs to any Government, authority or person may also be exercised by any High Court exercising jurisdiction in relation to the territories within which the cause of action, wholly or in part, arises for the exercise of such power, notwithstanding that the seat of such Government or authority or the residence of such person is not within those territories
 (3) Where any party against whom an interim order, whether by way of injunction or stay or in any other manner, is made on, or in any proceedings relating to, a petition under clause ( 1 ), without
 (a) furnishing to such party copies of such petition and all documents in support of the plea for such interim order; and
 (b) giving such party an opportunity of being heard, makes an application to the High Court for the vacation of such order and furnishes a copy of such application to the party in whose favour such order has been made or the counsel of such party, the High Court shall dispose of the application within a period of two weeks from the date on which it is received or from the date on which the copy of such application is so furnished, whichever is later, or where the High Court is closed on the last day of that period, before the expiry of the next day afterwards on which the High Court is open; and if the application is not so disposed of, the interim order shall, on the expiry of that period, or, as the case may be, the expiry of the aid next day, stand vacated
 (4) The power conferred on a High Court by this article shall not be in derogation of the power conferred on the Supreme court by clause ( 2 ) of Article 32""
226. A Constitutional validity of Central laws not to be considered in proceedings under Article 226 Omitted",Article 226: Power of High Courts to Issue Certain Writs,"(1) General Power to Issue Writs
Every High Court has the authority to issue directions, orders, or writs for:
Enforcing Fundamental Rights (Part III of the Constitution).
Other legal purposes.
Writs may include:
Habeas Corpus: Protects against unlawful detention.
Mandamus: Commands an authority to perform a duty.
Prohibition: Stops a lower court from acting beyond its jurisdiction.
Quo Warranto: Challenges the legality of a person’s claim to a public office.
Certiorari: Reviews and corrects decisions of lower courts or tribunals.
This power extends throughout the territories under the High Court’s jurisdiction.
(2) Jurisdiction Based on Cause of Action
High Courts can exercise their writ powers even if:
The seat of Government, authority, or person is outside their territorial jurisdiction,
as long as the cause of action arises (wholly or partially) within their jurisdiction.
(3) Interim Orders
High Courts can issue interim orders (e.g., injunctions or stays). However:
The opposing party must be:
Given copies of the petition and related documents.
Heard before the order is made.
If this is not done:
The opposing party may apply for the vacation of the interim order.
The High Court must decide on this application within two weeks (or on the next working day if the court is closed).
If not resolved in time, the interim order stands vacated.
(4) Relationship with Supreme Court’s Powers
High Courts’ writ powers under Article 226:
Do not override the Supreme Court’s authority under Article 32(2).
Article 226A: Omitted
This article, previously concerning the constitutional validity of Central laws, has been omitted."
227,"227. Power of superintendence over all courts by the High Court
 (1) Every High Court shall have superintendence over all courts and tribunals throughout the territories interrelation to which it exercises jurisdiction
 (2) Without prejudice to the generality of the foregoing provisions, the High Court may
 (a) call for returns from such courts;
 (b) make and issue general rules and prescribe forms for regulating the practice and proceedings of such courts; and
 (c) prescribe forms in which books, entries and accounts shall be kept by the officers of any such courts
 (3) The High Court may also settle tables of fees to be allowed to the sheriff and all clerks and officers of such courts and to attorneys, advocates and pleaders practising therein: Provided that any rules made, forms prescribed or tables settled under clause ( 2 ) or clause ( 3 ) shall not be inconsistent with the provision of any law for the time being in force, and shall require the previous approval of the Governor
 (4) Nothing in this article shall be deemed to confer on a High Court powers of superintendence over any court or tribunal constituted by or under any law relating to the Armed Forces",Article 227: Power of Superintendence Over All Courts by the High Court,"(1) General Superintendence
Every High Court has the power of superintendence over all courts and tribunals within its jurisdiction.
(2) Specific Powers of the High Court
The High Court may:
(a) Call for returns (reports) from such courts.
(b) Issue general rules and prescribe forms to regulate the practice and proceedings of such courts.
(c) Prescribe the formats in which court officers must maintain books, entries, and accounts.
(3) Fee Structures
The High Court can:
Settle tables of fees for:
Sheriffs, clerks, and officers of such courts.
Attorneys, advocates, and pleaders practicing in these courts.
Conditions:
These rules, forms, or fee tables must not conflict with any existing law.
They require the Governor’s prior approval.
(4) Exception: Armed Forces Courts and Tribunals
This article does not grant High Courts supervisory power over:
Courts or tribunals established under laws related to the Armed Forces.






"
228,"228. Transfer of certain cases to High Court If the High Court is satisified that a case pending in a court subordinate to it involves a substantial question of law as to the interpretation of this Constitution the determination of which is necessary for the disposal of the case, it shall withdraw the case and may
 (a) either dispose of the case itself, or
 (b) determine the said question of law and return the case to the court from which the case has been so withdrawn together with a copy of its judgment on such question, and the said court shall on receipt thereof proceed to dispose of the case in confirmity with such judgment""
228A. Special provisions as to disposal of question relating to constitutional validity of State Laws Rep by the Constitution (Forty third Amendment) Act, 1977 , sec 10, (w e f 13 4 1978 )",Article 228: Transfer of Certain Cases to High Court,"Power to Withdraw Cases
If a High Court is satisfied that:
A case pending in a subordinate court involves a substantial question of law about the interpretation of the Constitution, and
Resolving this question is necessary for the disposal of the case,
The High Court shall withdraw the case.
Actions by the High Court
After withdrawing the case, the High Court may:

(a) Dispose of the case itself, or
(b) Decide the question of law and return the case to the subordinate court, along with a copy of its judgment on the question.
The subordinate court must then proceed to dispose of the case in conformity with the High Court’s judgment.
Article 228A: Special Provisions for State Laws
This article, which related to the disposal of questions about the constitutional validity of State laws, was repealed by the Constitution (Forty-third Amendment) Act, 1977, Section 10 (effective from April 13, 1978)."
229,"229. Officers and servants and the expenses of High Courts
 (1) Appointments of officers and servants of a High Court shall be made by the Chief Justice of the Court or such other Judge or officer of the Court as he may direct: Provided that the Governor of the State may by rule require that in such cases as may be specified in the rule no person not already attached to the Court shall be appointed to any office connected with the Court save after consultation with the State Public Service Commission
 (2) Subject to the provisions of any law made by the Legislature of the State, the conditions of service of officers and servants of a High Court shall be such as may be prescribed by rules made by the Chief Justice of the Court or by some other Judge or officer of the Court authorised by the Chief Justice to make rules for the purpose: Provided that the rules made under this clause shall, so far as they relate to salaries, allowances, leave or pensions, require the approval of the Governor of the State
 (3) The administrative expenses of a High Court, including all salaries, allowacnes and pensions payable to or in respect of the officers and servants of the court, shall be charged upon the Consolidated Fund of the State, and any fees or other moneys taken by the Court shall form part of that Fund",Article 229: Officers and Servants and the Expenses of High Courts,"(1) Appointments
Authority: The Chief Justice of the High Court has the power to appoint officers and servants of the Court.
Delegation: The Chief Justice may delegate this power to another Judge or officer of the Court.
Governor's Role:
The Governor may make rules specifying cases where:
No new appointments (to offices connected with the Court) shall be made without consulting the State Public Service Commission, unless the person is already attached to the Court.
(2) Conditions of Service
Rule-Making Authority:
The Chief Justice or an authorised Judge/officer of the Court may prescribe the conditions of service for the Court’s officers and servants.
Governor's Approval:
Rules regarding salaries, allowances, leave, or pensions require the Governor's approval.
State Legislature's Role: These provisions are subject to laws made by the State Legislature.
(3) Administrative Expenses
Source of Funding:
The administrative expenses of the High Court (including salaries, allowances, and pensions) are charged to the Consolidated Fund of the State.
Revenue Handling:
Any fees or other monies collected by the High Court will also form part of the Consolidated Fund of the State.





"
