Article Number,Article,Title,Description
230,"230. Extension of jurisdiction of High Courts to Union territories
 (1) Parliament may by law extend the jurisdiction of a High Court to, or exclude the jurisdiction of a High Court from, any Union territory
 (2) Where the High Court of a State exercises jurisdiction in relation to a Union territory:
 (a) nothing in this Constitution shall be construed as empowering the Legislature of the State to increase, restrict or abolish that jurisdiction; and
 (b) the reference in article 227 to the Governor shall, in relation to any rules, forms or tables for subordinate courts in that territory, be construed as a reference to the President",Article 230: Extension of Jurisdiction of High Courts to Union Territories,"(1) Power of Parliament
Jurisdiction Alteration:
Parliament, by law, may:
Extend the jurisdiction of a High Court to any Union territory, or
Exclude the jurisdiction of a High Court from any Union territory.
(2) High Court Jurisdiction Over Union Territories
When a High Court of a State exercises jurisdiction over a Union territory:
(a) The Legislature of the State is not empowered to:
Increase, restrict, or abolish that jurisdiction.
(b) In the context of Article 227:
References to the Governor (regarding rules, forms, or tables for subordinate courts in that Union territory) shall be understood as references to the President."
231,"231. Establishment of a common High Court for two or more States
 (1) Notwithstanding anything contained in the preceding provisions of this Chapter, Parliament may by law establish a common High Court for two or more States or for two or more States and a Union territory
 (2) In relation to any such High Court,
 (a) the reference in article 217 to the Governor of the State shall be construed as a reference to the Governors of all the States in relation to which the High Court exercises jurisdiction;
 (b) the reference in article 227 to the Governor shall, in relation to any rules, forms or tables for subordinate courts, be construed as a reference to the Governor of the State in which the Subordinate Courts are situate; and
 (c) the reference in articles 219 and 229 to the State shall be construed as a reference to the State in which the High Court has its principal seat: Provided that if such principal seat is in a Union territory, the references in articles 210 and 229 to the Governor, Public Service Commission, Legislature and Consolidated Fund of the State shall be construed respectively as references to the President, Union Public Service Commission, Parliament and Consolidated Fund of India",Article 231: Establishment of a Common High Court for Two or More States,"(1) Power of Parliament to Establish a Common High Court
Parliament has the authority to establish a common High Court for:
Two or more States, or
Two or more States and a Union territory.
This can be done by law.
(2) Provisions Related to a Common High Court
For any common High Court established under this article:

(a) Governors in Reference to Article 217:
The reference in Article 217 (which deals with the appointment of High Court Judges) to the Governor of a State shall be understood as referring to the Governors of all the States for which the common High Court has jurisdiction.
(b) Governor in Reference to Article 227:
The reference in Article 227 (which relates to the superintendence of High Courts over subordinate courts) to the Governor shall, in the case of rules, forms, or tables for subordinate courts, be interpreted as a reference to the Governor of the State where the subordinate courts are located.
(c) State in Reference to Articles 219 and 229:
The references in Articles 219 (which deals with the oath of office of High Court Judges) and 229 (which concerns the officers and servants of High Courts) to the State shall be understood as referring to the State where the principal seat of the common High Court is located.
Exception: If the principal seat is located in a Union territory, the references in Articles 210 (dealing with the Governor’s role), 229 (dealing with officers and servants of the court), to Public Service Commission, Legislature, and Consolidated Fund shall be interpreted as references to the President, the Union Public Service Commission, Parliament, and the Consolidated Fund of India, respectively."
232,"232. Omitted by the Constitution 7 th Amendment Act, 1956 CHAPTER VI SUBORDINATE COURTS",Article 232: Omitted,"Article 232 was removed by the Constitution (7th Amendment) Act, 1956.
"
233,"233. Appointment of district judges
 (1) Appointments of persons to be, and the posting and promotion of, district judges in any State shall be made by the Governor of the State in consultation with the High Court exercising jurisdiction in relation to such State
 (2) A person not already in the service of the Union or of the State shall only be eligible to be appointed a district judge if he has been for not less than seven years an advocate or a pleader and is recommended by the High Court for appointment
233. A Validation of appointments of, and judgments, etc, delivered by, certain district judges Notwithstanding any judgment, decree or order of any court,
 (a)
 (i) no appointment of any person already in the judicial service of a State or of any person who has been for not less than seven years an advocate or a pleader, to be a district judge in that State, and
 (ii) no posting, promotion or transfer of any such person as a district judge, made at any time before the commencement of the Constitution (Twentieth Amendment) Act, 1966 , otherwise than in accordance with the provisions of Article 233 or Article 235 shall be deemed to be illegal or void or ever to have become illegal or void by reason only of the fact that such appointment, posting, promotion or transfer was not made in accordance with the said provisions;
 (b) no jurisdiction exercised, no judgment, decree, sentence or order passed or made, and no other act or proceeding done or taken, before the commencement of the Constitution (Twentieth Amendment) Act, 1966 by, or before, any person appointed, posted, promoted or transferred as a district judge in any State otherwise than in accordance with the provisions of Article 233 or Article 235 shall be deemed to be illegal or invalid or ever to have become illegal or invalid by reason only of the fact that such appointment, posting, promotion or transfer was not made in accordance with the said provisions",Article 233: Appointment of District Judges,"Appointments and Promotion of District Judges:

The Governor of the State is responsible for appointing district judges and making decisions about their posting and promotion.
The Governor must consult with the High Court of the respective state while making these decisions.
Eligibility Criteria for District Judges:

A person can only be appointed as a district judge if they have been:
An advocate or pleader for at least seven years, and
Recommended by the High Court for appointment.
This eligibility rule applies to individuals who are not already part of the Union or State services.
Article 233A: Validation of Appointments of, and Judgments Delivered by, Certain District Judges
This article validates certain appointments and actions taken by district judges prior to the commencement of the Constitution (Twentieth Amendment) Act, 1966. It ensures that actions before this amendment are not invalidated due to procedural issues.

Appointments, Postings, and Promotions:

Appointments, postings, promotions, or transfers of district judges made before the 1966 amendment are deemed valid, even if they were not made in strict accordance with Article 233 or Article 235.
Judgments and Actions by District Judges:

Any judgments, decrees, sentences, or other actions taken by district judges before the 1966 amendment, which might not have followed the rules laid out in Article 233 or Article 235, are also considered valid. These actions are not to be regarded as illegal or invalid just because they were not strictly in line with the provisions."
234,234. Recruitment of persons other than district judges to the judicial service Appointment of persons other than district judges to the judicial service of a State shall be made by the Governor of the State in accordance with rules made by him in that behalf after consultation with the State Public Service Commission and with the High Court exercising jurisdiction in relation to such State,Article 234: Recruiting Other Judicial Officers,"Other judicial officers (like judges of subordinate courts) are appointed by the Governor, after consulting with the High Court. These officers are selected based on recommendations from the State Public Service Commission, which ensures that only qualified individuals are chosen for judicial roles."
235,"235. Control over subordinate courts The control over district courts and courts subordinate thereto including the posting and promotion of, and the grant of leave to, persons belonging to the judicial service of a State and holding any post inferior to the post of district judge shall be vested in the High Court, but nothing in this article shall be construed as taking away from any such person any right of appeal which he may under the law regulating the conditions of his service or as authorising the High Court to deal with him otherwise than in accordance with the conditions of his service prescribed under such law",Article 235: Control Over Subordinate Courts,"High Courts have control over the subordinate courts within their jurisdiction. This means the High Court can supervise these courts, decide who works there, and even recommend promotions. This control helps maintain the integrity and efficiency of the entire judicial system.

Each of these provisions helps maintain the structure, independence, and functioning of the judiciary in India. They ensure that judges are appointed, remunerated, and held accountable, and they define the relationship between High Courts, lower courts, and the central government."
236,"236. Interpretation In this Chapter
 (a) the expression district judge includes judge of a city civil court, additional district judge, joint district judge, assistant district judge, chief judge of a small cause court, chief presidency magistrate, additional chief presidency magistrate, sessions judge, additional sessions judge and assistant sessions judge;
 (b) the expression judicial service means a service consisting exclusively of persons intended to fill the post of district judge and other civil judicial posts inferior to the post of district judge",Article 236: Interpretation in this Chapter,"District Judge:

The term ""district judge"" includes a variety of judicial roles that are either equivalent to or fall under the district judge category. These include:
Judge of a City Civil Court
Additional District Judge
Joint District Judge
Assistant District Judge
Chief Judge of a Small Cause Court
Chief Presidency Magistrate
Additional Chief Presidency Magistrate
Sessions Judge
Additional Sessions Judge
Assistant Sessions Judge
Judicial Service:

The term ""judicial service"" refers to a service composed solely of individuals who are intended to fill the roles of district judges and other civil judicial positions that are below the rank of a district judge."
237,237. Application of the provisions of this Chapter to certain class or classes of magistrates The Governor may by public notification direct that the foregoing provisions of this Chapter and any rules made thereunder shall with effect from such date as may be fixed by him in that behalf apply in relation to any class or classes of magistrates in the State as they apply in relation to persons appointed to the judicial service of the State subject to such exceptions and modifications as may be specified in the notification,Article 237: Application of Provisions to Magistrates,"This article allows the Governor to make rules about how certain judicial provisions apply to magistrates.

The Governor can use a public notification to make these rules apply to specific classes of magistrates.
These rules would be similar to the ones for judicial officers in the state, but there may be some exceptions or modifications depending on the situation."