Article Number,Article,Title,Description
206,"206. Votes on account, votes of credit and exceptional grants
 (1) Notwithstanding anything in the foregoing provisions of this Chapter, the Legislative Assembly of a State shall have power
 (a) to make any grant in advance in respect of the estimated expenditure for a part of any financial year pending the completion of the procedure prescribed in article 203 for the voting of such grant and the passing of the law in accordance with the provisions of article 204 in relation to that expenditure;
 (b) to make a grant for meeting an unexpected demand upon the resources of the State when on account of the magnitude or the indefinite character of the service the demand cannot be stated with the details ordinarily given in an annual financial statement;
 (c) to make an exceptional grant which forms no part of the current service of any financial year, and the Legislature of the State shall have power to authorise by law the withdrawal of moneys from the Consolidated Fund of the State for the purposes for which the said grants are made
 (2) The provisions of articles 203 and 204 shall have effect in relation to the making of any grant under clause ( 1 ) and to any law to be made under that clause as they have effect in relation to the making of a grant with regard to any expenditure mentioned in the annual financial statement and the law to be made for the authorisation of appropriation of moneys out of the Consolidated Fund of the State to meet such expenditure","Article 206: Votes on Account, Votes of Credit, and Exceptional Grants","This article provides the Legislative Assembly of a State with the power to approve certain types of grants in exceptional circumstances.

(1) Types of Grants:
The Legislative Assembly of a State has the authority to make the following types of grants:

(a) Grant in Advance (Votes on Account):
The Assembly can approve a temporary grant for part of the financial year before the full financial procedures (as described in Article 203) are completed. This is used to ensure the government can function while waiting for the final budget approval.
(b) Grant for Unexpected Demands (Votes of Credit):
If an unexpected demand arises that cannot be predicted in the annual financial statement due to its magnitude or indefinite nature, the Assembly can approve a grant to meet this unforeseen expenditure.
This is generally for emergencies or large-scale unforeseen needs that cannot be included in the normal budgeting process.
(c) Exceptional Grant:
The Assembly can make a grant for special circumstances that don't fall under regular yearly expenditure. These are grants that do not form part of the current service of the year but are necessary for certain extraordinary needs.
In all these cases, the Legislature of the State can pass laws authorizing the withdrawal of money from the Consolidated Fund of the State for these specific grants.

(2) Applicability of Articles 203 and 204:
The provisions of Articles 203 (Estimates and approval of expenditure) and 204 (Appropriation Bill) still apply to any grants made under Article 206(1). This means the process for authorizing the expenditure and appropriation of funds from the Consolidated Fund remains the same as for the regular annual financial grants."
207,"207. Special provisions as to financial Bills
 (1) A Bill or amendment making provision for any of the matters specified in sub clause (a) to (f) of clause ( 1 ) of article 199 shall not be introduced or moved except on the recommendation of the Governor, and a Bill making such provision shall not be introduced in a Legislative Council: Provided that no recommendation shall be required under this clause for the moving of an amendment making provision for the reduction or abolition of any tax
 (2) A Bill or amendment shall not be deemed to make provision for any of the matters aforesaid by reason only that it provides for the imposition of fines or other pecuniary penalties, or for the demand or payment of fees for licences or fees for services rendered, or by reason that it provides for the imposition, abolition, remission, alteration or regulation of any tax by any local authority or body for local purposes
 (3) A Bill which, if enacted and brought into operation, would involve expenditure from the Consolidated Fund of a State shall not be passed by a House of the Legislature of the State unless the Governor has recommended to that House the consideration of the Bill Procedure Generally",Article 207: Special Provisions as to Financial Bills,"This article deals with specific procedures related to Financial Bills in the State Legislature.

(1) Introduction of Financial Bills:
A Financial Bill (or an amendment to a Bill) that deals with certain financial matters (as specified in Article 199) can only be introduced on the recommendation of the Governor.
The matters specified in Article 199 include areas such as taxes, borrowing money, custody of funds, appropriation of money, and financial obligations of the State.
Prohibition on Introduction in the Legislative Council:
Such a Financial Bill cannot be introduced in the Legislative Council. It must originate in the Legislative Assembly.
Exception for Amendment of Taxes:
No recommendation from the Governor is required for an amendment that proposes to reduce or abolish any tax. This is an exception to the rule that requires the Governor's recommendation.
(2) Financial Bills Definition:
A Bill or amendment shall not be considered a Financial Bill solely because it imposes fines, penalties, or fees. It also does not become a Financial Bill just because it relates to the imposition or regulation of taxes by a local authority for local purposes (such as taxes levied for municipal services).
(3) Recommendation by the Governor for Financial Expenditure:
A Bill that requires expenditure from the Consolidated Fund of the State (the State's primary financial resource) cannot be passed by any House of the State Legislature unless the Governor has recommended that the Bill be considered.
This ensures that financial matters requiring the allocation of funds are controlled and recommended by the Governor before the Legislature takes them up."
208,"208. Rules of procedure
 (1) A House of the Legislature of a State may make rules for regulating subject to the provisions of this Constitution, its procedure and the conduct of its business
 (2) Until rules are made under clause ( 1 ), the rules of procedure and standing orders in force immediately before the commencement of this Constitution with respect to the Legislature for the corresponding Province shall have effect in relation to the Legislature of the State subject to such modifications and adaptations as may be made therein by the Speaker of the Legislative Assembly, or the Chairman of the Legislative Council, as the case may be
 (3) In a State having a Legislative Council the Governor, after consultation with the Speaker of the Legislative Assembly and the Chairman of the legislative Council, may make rules as to the procedure with respect to communications between the two Houses",Article 208: Rules of Procedure,"This article deals with the procedure and conduct of business within the Legislature of a State.

(1) Power to Make Rules:
A House of the Legislature in a State is empowered to make rules to regulate its procedure and conduct of business, but these rules must be consistent with the provisions of the Constitution.
(2) Interim Rules:
If no new rules are made under clause (1), the existing rules of procedure and standing orders from before the Constitution's commencement (for the corresponding Province) will continue to apply. However, these rules may be modified or adapted by:
The Speaker of the Legislative Assembly (for the Assembly).
The Chairman of the Legislative Council (for the Council).
(3) Procedure for Communications Between Houses:
In a State with a Legislative Council, the Governor, after consulting both the Speaker of the Legislative Assembly and the Chairman of the Legislative Council, has the authority to make rules specifically for the communication between the two Houses."
209,"209. Regulation by law of procedure in the Legislature of the State in relation to financial business The Legislature of a State may, for the purpose of the timely completion of financial business, regulate by law the procedure of, and the conduct of business in, the House or Houses of the Legislature of the State in relation to any financial matter or to any Bill for the appropriation of moneys out of the Consolidated Fund of the State, and, if and so far as any provision of any law so made is inconsistent with any rule made by the House or either House of the Legislature of the State under clause ( 1 ) of article 208 or with any rule or standing order having effect in relation to the Legislature of the State under clause ( 2 ) of that article, such provision shall prevail",Article 209: Regulation of Procedure for Financial Business,"States can make laws to regulate how financial matters are handled in the legislature.
If there’s any conflict between the new law and the existing legislature rules, the new law about financial matters will take precedence."
210,"210. Language to be used in the Legislature
 (1) Notwithstanding anything in Part XVII, but subject to the provisions of article 348, business in the Legislature of a State shall be transacted in the official language or languages of the State or in Hindi or in English: Provided that the Speaker of the Legislative Assembly or Chairman of the Legislative Council, or person acting as such, as the case may be, may permit any member who cannot adequately express himself in any of the languages aforesaid to address the House in his mother tongue
 (2) Unless the Legislature of the State by law otherwise provides, this article shall, after the expiration of a period of fifteen years from the commencement of this Constitution, have effect as if the words or in English were omitted here from: Provided that in relation to the Legislatures of the States of Himachal Pradesh, Manipur, Meghalaya and Tripura this clause shall have effect as if for the words fifteen years occurring therein, the words twenty five years were substituted: Provided further that in relation to the Legislature of the States of Arunachal Pradesh, Goa and Mizoram, this clause shall have effect as if for the words fifteen years occurring therein, the words forty years were substituted",Article 210: Language in the Legislature,"Business in the State legislature can be done in the State’s official language, Hindi, or English.
If someone can’t speak these languages well, they can use their mother tongue with permission from the Speaker or Chairman.
After 15 years of the Constitution starting, the use of English in the legislature will end, unless a State legislature says otherwise. Some States like Himachal Pradesh, Manipur, Meghalaya, and Tripura will have 25 years, and Arunachal Pradesh, Goa, and Mizoram will have 40 years.
"
211,211. Restriction on discussion in the Legislature No discussion shall take place in the Legislature of a State with respect to the conduct of any Judge of the Supreme Court or of a High Court in the discharge of his duties,Article 211: Restriction on Discussions,"In the State legislature, there cannot be any discussions about how a Supreme Court or High Court judge does their job."
212,"212. Courts not to inquire into proceedings of the Legislature
 (1) The validity of any proceedings in the Legislature of a State shall not be called in question on the ground of any alleged irregularity of procedure
 (2) No officer or member of the Legislature of a State in whom powers are vested by or under this Constitution for regulating procedure or the conduct of business, or for maintaining order, in the Legislature shall be subject to the jurisdiction of any court in respect of the exercise by him of those powers CHAPTER IV LEGISLATIVE POWER OF THE GOVERNOR",Article 212: Courts Cannot Question Legislative Proceedings,"Courts cannot question the State legislature’s proceedings, even if there’s a mistake in how things were done.
If someone in the legislature is in charge of keeping order or managing business, they cannot be taken to court for how they do their job.
"
213,"213. Power of Governor to promulgate Ordinances during recess of Legislature
 (1) If at any time, except when the Legislative Assembly of a State is in session, or where there is a Legislative Council in a State, except when both Houses of the Legislature are in session, the Governor is satisfied that circumstances exist which render it necessary for him to take immediate action, he may promulgate such Ordinance as the circumstances appear to him to require: Provided that the Governor shall not, without instructions from the President, promulgate any such Ordinance if
 (a) a Bill containing the same provisions would under this Constitution have required the previous sanction of the President for the introduction thereof into the Legislature; or
 (b) he would have deemed it necessary to reserve a Bill containing the same provisions for the consideration of the President; or
 (c) an Act of the Legislature of the State containing the same provisions would under this Constitution have been invalid unless, having been reserved for the consideration of the President, it had received the assent of the President
 (2) An Ordinance promulgated under this article shall have the same force and effect as an Act of Legislature of the State assented to by the Governor, but every such Ordinance
 (a) shall be laid before the legislative Assembly of the State, or where there is a Legislative Council in the State, before both the House, and shall cease to operate at the expiration of six weeks from the reassembly of the Legislature, or if before the expiration of that period a resolution disapproving it is passed by the Legislative Assembly and agreed to by the Legislative Council, if any, upon the passing of the resolution or, as the case may be, on the resolution being agreed to by the Council; and
 (b) may be withdrawn at any time by the Governor Explanation Where the Houses of the Legislature of a State having a Legislative Council are summoned to reassemble on different dates, the period of six weeks shall be reckoned from the later of those dates for the purposes of this clause
 (3) If and so far as an Ordinance under this article makes any provision which would not be valid if enacted in an Act of the legislature of the State assented to by the Governor, it shall be void: Provided that, for the purposes of the provisions of this Constitution relating to the effect of an Act of the Legislature of a State which is repugnant to an Act of Parliament or an existing law with respect to a matter enumerated in the Concurrent List, an Ordinance promulgated under this article in the Concurrent List, an Ordinance promulgated under this article in pursuance of instructions from the President shall be deemed to be an Act of the Legislature of the State which has been reserved for the consideration of the president and assented to by him CHAPTER V THE HIGH COURTS IN THE STATES",Article 213: Power of Governor to Promulgate Ordinances During Recess of Legislature,"This article empowers the Governor of a State to issue Ordinances when the Legislature is not in session, under certain circumstances.

(1) Conditions for Promulgation of Ordinance:
The Governor can issue an Ordinance when there is an urgent need for action and the Legislative Assembly is not in session, or when both Houses of the Legislature (if there is a Legislative Council) are not in session.
However, the Governor cannot promulgate an Ordinance if:
A Bill containing the same provisions would have required the previous sanction of the President for its introduction.
He would have needed to reserve a Bill for the President's consideration.
An Act passed by the Legislature, containing similar provisions, would have been invalid without Presidential assent.
(2) Effect and Duration of Ordinance:
The Ordinance will have the same effect as an Act of the Legislature, assented to by the Governor.
However, the Ordinance:
Must be laid before the Legislative Assembly (or both Houses if there is a Legislative Council).
Will expire after six weeks from the reassembly of the Legislature unless it is approved earlier. If the Legislative Assembly disapproves the Ordinance and the Legislary Council (if present) agrees, it will cease to have effect.
The Governor can withdraw the Ordinance at any time.
Note: If the two Houses of the Legislature are to reassemble on different dates, the six-week period is counted from the later of those dates.
(3) Validity of Ordinance:
If an Ordinance makes a provision that would be invalid if enacted by the Legislature, it will be void.
However, for purposes related to the Concurrent List in the Constitution, an Ordinance issued under this article, in pursuance of instructions from the President, will be treated as an Act that was reserved for the President's consideration and assented to by him.
"